[
  {
    "id": "sutra_1_01",
    "chapterId": "chapter_1",
    "order": 1,
    "number": "1.1",
    "sanskrit": "atha yogānuśāsanam",
    "initialWord": "atha",
    "media": {
      "video": null
    }
  },
  {
    "id": "sutra_1_02",
    "chapterId": "chapter_1",
    "order": 2,
    "number": "1.2",
    "sanskrit": "yogaś citta-vṛtti-nirodhaḥ",
    "initialWord": "yogaś",
    "media": {
      "video": null
    }
  },
  {
    "id": "sutra_1_03",
    "chapterId": "chapter_1",
    "order": 3,
    "number": "1.3",
    "sanskrit": "tadā draṣṭuḥ svarūpe avasthānam",
    "initialWord": "tadā",
    "media": {
      "video": null
    }
  },
  {
    "id": "sutra_1_04",
    "chapterId": "chapter_1",
    "order": 4,
    "number": "1.4",
    "sanskrit": "vṛtti-sārūpyam itaratra",
    "initialWord": "vṛtti-sārūpyam",
    "media": {
      "video": null
    }
  },
  {
    "id": "sutra_1_05",
    "chapterId": "chapter_1",
    "order": 5,
    "number": "1.5",
    "sanskrit": "vṛttayaḥ pañcatayyaḥ kliṣṭā akliṣṭāḥ",
    "initialWord": "vṛttayaḥ",
    "media": {
      "video": null
    }
  },
  {
    "id": "sutra_1_06",
    "chapterId": "chapter_1",
    "order": 6,
    "number": "1.6",
    "sanskrit": "pramāṇa viparyaya vikalpa nidrā smṛtayaḥ",
    "initialWord": "pramāṇa",
    "media": {
      "video": null
    }
  },
  {
    "id": "sutra_1_07",
    "chapterId": "chapter_1",
    "order": 7,
    "number": "1.7",
    "sanskrit": "pratyakṣa anumāna āgamāḥ pramāṇāni",
    "initialWord": "pratyakṣa",
    "media": {
      "video": null
    }
  },
  {
    "id": "sutra_1_08",
    "chapterId": "chapter_1",
    "order": 8,
    "number": "1.8",
    "sanskrit": "viparyayo mithyā-jñānam atadrūpa pratiṣṭham",
    "initialWord": "viparyayo",
    "media": {
      "video": null
    }
  },
  {
    "id": "sutra_1_09",
    "chapterId": "chapter_1",
    "order": 9,
    "number": "1.9",
    "sanskrit": "śabda-jñāna anupātī vastu-śūnyo vikalpaḥ",
    "initialWord": "śabda-jñāna",
    "media": {
      "video": null
    }
  },
  {
    "id": "sutra_1_10",
    "chapterId": "chapter_1",
    "order": 10,
    "number": "1.10",
    "sanskrit": "abhāva pratyaya ālambanā vṛttir nidrā",
    "initialWord": "abhāva",
    "media": {
      "video": null
    }
  },
  {
    "id": "sutra_1_11",
    "chapterId": "chapter_1",
    "order": 11,
    "number": "1.11",
    "sanskrit": "anubhūta viṣaya asaṁpramoṣaḥ smṛtiḥ",
    "initialWord": "anubhūta",
    "media": {
      "video": null
    }
  },
  {
    "id": "sutra_1_12",
    "chapterId": "chapter_1",
    "order": 12,
    "number": "1.12",
    "sanskrit": "abhyāsa vairāgyābhyāṁ tan nirodhaḥ",
    "initialWord": "abhyāsa",
    "media": {
      "video": null
    }
  },
  {
    "id": "sutra_1_13",
    "chapterId": "chapter_1",
    "order": 13,
    "number": "1.13",
    "sanskrit": "tatra sthitau yatno abhyāsaḥ",
    "initialWord": "tatra",
    "media": {
      "video": null
    }
  },
  {
    "id": "sutra_1_14",
    "chapterId": "chapter_1",
    "order": 14,
    "number": "1.14",
    "sanskrit": "sa tu dīrgha kāla nairantarya satkārāsevito dṛḍha-bhūmiḥ",
    "initialWord": "sa",
    "media": {
      "video": null
    }
  },
  {
    "id": "sutra_1_15",
    "chapterId": "chapter_1",
    "order": 15,
    "number": "1.15",
    "sanskrit": "dṛṣṭānuśravika viṣaya vitṛṣṇasya vaśīkāra saṁjñā vairāgyam",
    "initialWord": "dṛṣṭānuśravika",
    "media": {
      "video": null
    }
  },
  {
    "id": "sutra_1_16",
    "chapterId": "chapter_1",
    "order": 16,
    "number": "1.16",
    "sanskrit": "tat paraṁ puruṣa khyāter guṇa vaitṛṣṇyam",
    "initialWord": "tat",
    "media": {
      "video": null
    }
  },
  {
    "id": "sutra_1_17",
    "chapterId": "chapter_1",
    "order": 17,
    "number": "1.17",
    "sanskrit": "vitarka vicāra ānanda asmitā rūpa anugamāt samprajñātaḥ",
    "initialWord": "vitarka",
    "media": {
      "video": null
    }
  },
  {
    "id": "sutra_1_18",
    "chapterId": "chapter_1",
    "order": 18,
    "number": "1.18",
    "sanskrit": "virāma pratyaya abhyāsa pūrvaḥ saṁskāra śeṣo anyaḥ",
    "initialWord": "virāma",
    "media": {
      "video": null
    }
  },
  {
    "id": "sutra_1_19",
    "chapterId": "chapter_1",
    "order": 19,
    "number": "1.19",
    "sanskrit": "bhava pratyayo videha prakṛti layānām",
    "initialWord": "bhava",
    "media": {
      "video": null
    }
  },
  {
    "id": "sutra_1_20",
    "chapterId": "chapter_1",
    "order": 20,
    "number": "1.20",
    "sanskrit": "śraddhā vīrya smṛti samādhi prajñā pūrvaka itareṣām",
    "initialWord": "śraddhā",
    "media": {
      "video": null
    }
  },
  {
    "id": "sutra_1_21",
    "chapterId": "chapter_1",
    "order": 21,
    "number": "1.21",
    "sanskrit": "tīvra saṁvegānām āsannaḥ",
    "initialWord": "tīvra",
    "media": {
      "video": null
    }
  },
  {
    "id": "sutra_1_22",
    "chapterId": "chapter_1",
    "order": 22,
    "number": "1.22",
    "sanskrit": "mṛdu madhya adhimātratvāt tato api viśeṣaḥ",
    "initialWord": "mṛdu",
    "media": {
      "video": null
    }
  },
  {
    "id": "sutra_1_23",
    "chapterId": "chapter_1",
    "order": 23,
    "number": "1.23",
    "sanskrit": "īśvara praṇidhānād vā",
    "initialWord": "īśvara",
    "media": {
      "video": null
    }
  },
  {
    "id": "sutra_1_24",
    "chapterId": "chapter_1",
    "order": 24,
    "number": "1.24",
    "sanskrit": "kleśa karma vipāka āśayair aparāmṛṣṭaḥ puruṣa viśeṣa īśvaraḥ",
    "initialWord": "kleśa",
    "media": {
      "video": null
    }
  },
  {
    "id": "sutra_1_25",
    "chapterId": "chapter_1",
    "order": 25,
    "number": "1.25",
    "sanskrit": "tatra niratiśayaṁ sarvajña bījam",
    "initialWord": "tatra",
    "media": {
      "video": null
    }
  },
  {
    "id": "sutra_1_26",
    "chapterId": "chapter_1",
    "order": 26,
    "number": "1.26",
    "sanskrit": "sa pūrveṣām api guruḥ kālena anavacchedāt",
    "initialWord": "sa",
    "media": {
      "video": null
    }
  },
  {
    "id": "sutra_1_27",
    "chapterId": "chapter_1",
    "order": 27,
    "number": "1.27",
    "sanskrit": "tasya vācakaḥ praṇavaḥ",
    "initialWord": "tasya",
    "media": {
      "video": null
    }
  },
  {
    "id": "sutra_1_28",
    "chapterId": "chapter_1",
    "order": 28,
    "number": "1.28",
    "sanskrit": "taj japas tad artha bhāvanam",
    "initialWord": "taj",
    "media": {
      "video": null
    }
  },
  {
    "id": "sutra_1_29",
    "chapterId": "chapter_1",
    "order": 29,
    "number": "1.29",
    "sanskrit": "tataḥ pratyak cetana adhigamo api antarāya abhāvaś ca",
    "initialWord": "tataḥ",
    "media": {
      "video": null
    }
  },
  {
    "id": "sutra_1_30",
    "chapterId": "chapter_1",
    "order": 30,
    "number": "1.30",
    "sanskrit": "vyādhi styāna saṁśaya pramāda ālasya avirati bhrānti darśana alabdha bhūmikatva anavasthitatvāni citta vikṣepāḥ te antarāyāḥ",
    "initialWord": "vyādhi",
    "media": {
      "video": null
    }
  },
  {
    "id": "sutra_1_31",
    "chapterId": "chapter_1",
    "order": 31,
    "number": "1.31",
    "sanskrit": "duḥkha daurmanasya aṅgamejayatva śvāsa praśvāsā vikṣepa sahabhuvaḥ",
    "initialWord": "duḥkha",
    "media": {
      "video": null
    }
  },
  {
    "id": "sutra_1_32",
    "chapterId": "chapter_1",
    "order": 32,
    "number": "1.32",
    "sanskrit": "tat pratiṣedhārtham eka tattva abhyāsaḥ",
    "initialWord": "tat",
    "media": {
      "video": null
    }
  },
  {
    "id": "sutra_1_33",
    "chapterId": "chapter_1",
    "order": 33,
    "number": "1.33",
    "sanskrit": "maitrī karuṇā muditā upekṣāṇāṁ sukha duḥkha puṇya apuṇya viṣayāṇāṁ bhāvanātaḥ citta prasādanam",
    "initialWord": "maitrī",
    "media": {
      "video": null
    }
  },
  {
    "id": "sutra_1_34",
    "chapterId": "chapter_1",
    "order": 34,
    "number": "1.34",
    "sanskrit": "pracchardana vidāraṇābhyāṁ vā prāṇasya",
    "initialWord": "pracchardana",
    "media": {
      "video": null
    }
  },
  {
    "id": "sutra_1_35",
    "chapterId": "chapter_1",
    "order": 35,
    "number": "1.35",
    "sanskrit": "viṣayavatī vā pravṛttir utpannā manasaḥ sthiti nibandhinī",
    "initialWord": "viṣayavatī",
    "media": {
      "video": null
    }
  },
  {
    "id": "sutra_1_36",
    "chapterId": "chapter_1",
    "order": 36,
    "number": "1.36",
    "sanskrit": "viśokā vā jyotiṣmatī",
    "initialWord": "viśokā",
    "media": {
      "video": null
    }
  },
  {
    "id": "sutra_1_37",
    "chapterId": "chapter_1",
    "order": 37,
    "number": "1.37",
    "sanskrit": "vīta rāga viṣayaṁ vā cittam",
    "initialWord": "vīta",
    "media": {
      "video": null
    }
  },
  {
    "id": "sutra_1_38",
    "chapterId": "chapter_1",
    "order": 38,
    "number": "1.38",
    "sanskrit": "svapna nidrā jñāna ālambanaṁ vā",
    "initialWord": "svapna",
    "media": {
      "video": null
    }
  },
  {
    "id": "sutra_1_39",
    "chapterId": "chapter_1",
    "order": 39,
    "number": "1.39",
    "sanskrit": "yathā abhimata dhyānād vā",
    "initialWord": "yathā",
    "media": {
      "video": null
    }
  },
  {
    "id": "sutra_1_40",
    "chapterId": "chapter_1",
    "order": 40,
    "number": "1.40",
    "sanskrit": "paramāṇu parama mahattva antaḥ asya vaśīkāraḥ",
    "initialWord": "paramāṇu",
    "media": {
      "video": null
    }
  },
  {
    "id": "sutra_1_41",
    "chapterId": "chapter_1",
    "order": 41,
    "number": "1.41",
    "sanskrit": "kṣīṇa vṛtter abhijātasya iva maṇeḥ grahītṛ grahaṇa grāhyeṣu tatstha tad añjanatā samāpattiḥ",
    "initialWord": "kṣīṇa",
    "media": {
      "video": null
    }
  },
  {
    "id": "sutra_1_42",
    "chapterId": "chapter_1",
    "order": 42,
    "number": "1.42",
    "sanskrit": "tatra śabda artha jñāna vikalpaiḥ saṅkīrṇā savitarkā samāpattiḥ",
    "initialWord": "tatra",
    "media": {
      "video": null
    }
  },
  {
    "id": "sutra_1_43",
    "chapterId": "chapter_1",
    "order": 43,
    "number": "1.43",